{
  "schemaId": "platform-architecture-policy.v0",
  "version": "0.0.0",
  "scanRoots": [
    "bin",
    "scripts",
    "src"
  ],
  "bootstrapChangeBoundary": {
    "baseCommit": "32543bfb7c5701c054f9c8c157a4f7cf0504fcbf",
    "admittedPolicySha256": "2c8b25a7680bd9eb433d48b9369aac869fc7fd4f4b288e07c50a8051d0ce55a0",
    "policySchemaSha256": "1e83158351aea11f56490b49087e33dbddfe24ac7955b799f105aee981c0b272",
    "adapterManifestSha256": "76d9060d20197ca524bc0087bf426b600c7a6e4a44db595b6bb4a374c2f864bb"
  },
  "adapterManifestPath": "fixtures/design-system-compiler/targets.manifest.json",
  "adapterDataRoot": "sources/design-system-compiler",
  "migrationBaseline": {
    "path": "fixtures/platform-path-consolidation/baseline.manifest.json",
    "sha256": "be51419b5b3f3eb43bdfae4b6a6d27e98f2b2336c18c9f5c7fb395663d6da71c",
    "admittedEvidenceSelfHashes": [
      {"path":"artifacts/capability-index/evidence.json","sha256":"cb1f77022dde4d9507a07cad73e87a36e2684691108d684bcb7b7c9fb35b8549"},
      {"path":"artifacts/design-system-compiler/evidence.json","sha256":"c12af6fdc35fb863053b9931aee8769c6eea62751b94589cdea130eb47d95dc2"},
      {"path":"artifacts/source-accessibility-policy/evidence.json","sha256":"2b67b1c29bb8f0584c95688b73ce0ae1ea93a8c69f7f032d413f5fd3f6918f7b"},
      {"path":"artifacts/source-family-component-identity-mapping/evidence.json","sha256":"86a110d8a8e2c4f9d8c9396f29de4693531475256f0ce483eae724e38f88e6e5"},
      {"path":"artifacts/source-family-layout-mapping/evidence.json","sha256":"0c98ced6279a682705c687cee3378ff77656e263bff63830a9ac43f09cd5162b"},
      {"path":"artifacts/source-family-namespace-mapping/evidence.json","sha256":"2b67275fdcf858cf4624d2561d6b1cd9b2a3ddebe9581095931f9f776ad7c9e5"},
      {"path":"artifacts/source-family-packaging/evidence.json","sha256":"374e515d807b6876b889771488ea0b502f0aaa429e919e69660d877506d841bb"},
      {"path":"artifacts/spectrum-checkbox-catalog/evidence.json","sha256":"68ee450316bb6e3ad0c8b0dd2b44ed20f8765965be93e4f69eace343d5f1ad45"}
    ],
    "admittedCatalogReportClosureHashes": [
      {"path":"artifacts/capability-index/evidence.json","sha256":"ab242919ddc1d3d8cb91c81d2e5e0a0ad4b8ae3fe75a3f6692f7f1df4e7b34dc"},
      {"path":"artifacts/design-system-compiler/evidence.json","sha256":"04d752e26dfc5c995c69cbd6b44b273852acb735580ad451f6a1545aa0d71532"},
      {"path":"artifacts/source-accessibility-policy/evidence.json","sha256":"5d37a9ffc8dc19d7202f24c62d41ee051cbea456cdcb42784e358b820083eb54"},
      {"path":"artifacts/source-family-component-identity-mapping/evidence.json","sha256":"a8dec4b40a13453e021ca7099239340e3e76ed31c3ab1447c663c02ecc6387ee"},
      {"path":"artifacts/source-family-layout-mapping/evidence.json","sha256":"4ae35a0efc0a19c67a9464f856e54a44f11df6e384164bee252f3bf97464be4b"},
      {"path":"artifacts/source-family-namespace-mapping/evidence.json","sha256":"5e5c77375117c64a74fa509c52094a8b5e0123b329f2c1af5961c48fd5cfcb37"},
      {"path":"artifacts/source-family-packaging/evidence.json","sha256":"8d725dcc3b82fa41e25afaa566513e0b984e3a7c641fe5992abb8d0412f55920"}
    ],
    "inventoryExcludedPrefixes": [
      "artifacts/capability-index",
      "artifacts/design-system-compiler",
      "fixtures/design-system-compiler",
      "sources/design-system-compiler"
    ],
    "postBaselinePaths": [
      ".github/workflows/platform-architecture-trusted.yml",
      ".gitignore",
      "AGENTS.md",
      "PLAN.md",
      "PROGRESS.md",
      "README.md",
      "VISION.md",
      "fixtures/platform-path-consolidation/architecture-policy.json",
      "fixtures/platform-path-consolidation/mutations/adapter-consumer-fixture-escape.platform-architecture-mutation.json",
      "fixtures/platform-path-consolidation/mutations/adapter-executable-payload.platform-architecture-mutation.json",
      "fixtures/platform-path-consolidation/mutations/adapter-existing-closure-rewrite.platform-architecture-mutation.json",
      "fixtures/platform-path-consolidation/mutations/adapter-fixture-root-reuse.platform-architecture-mutation.json",
      "fixtures/platform-path-consolidation/mutations/adapter-path-traversal.platform-architecture-mutation.json",
      "fixtures/platform-path-consolidation/mutations/adapter-roster-rewrite.platform-architecture-mutation.json",
      "fixtures/platform-path-consolidation/mutations/added-legacy-exception.platform-architecture-mutation.json",
      "fixtures/platform-path-consolidation/mutations/bespoke-compiler-path.platform-architecture-mutation.json",
      "fixtures/platform-path-consolidation/mutations/cjs-require.platform-architecture-mutation.json",
      "fixtures/platform-path-consolidation/mutations/computed-loader.platform-architecture-mutation.json",
      "fixtures/platform-path-consolidation/mutations/direct-p2-read.platform-architecture-mutation.json",
      "fixtures/platform-path-consolidation/mutations/duplicate-canonical-owner.platform-architecture-mutation.json",
      "fixtures/platform-path-consolidation/mutations/existing-neutral-executable-drift.platform-architecture-mutation.json",
      "fixtures/platform-path-consolidation/mutations/existing-test-executable-drift.platform-architecture-mutation.json",
      "fixtures/platform-path-consolidation/mutations/generic-compiler-mutation-drift.platform-architecture-mutation.json",
      "fixtures/platform-path-consolidation/mutations/helper-bypass.platform-architecture-mutation.json",
      "fixtures/platform-path-consolidation/mutations/identity-concat.platform-architecture-mutation.json",
      "fixtures/platform-path-consolidation/mutations/identity-regex.platform-architecture-mutation.json",
      "fixtures/platform-path-consolidation/mutations/legacy-implementation-expansion.platform-architecture-mutation.json",
      "fixtures/platform-path-consolidation/mutations/migration-baseline-rewrite.platform-architecture-mutation.json",
      "fixtures/platform-path-consolidation/mutations/neutral-executable-route.platform-architecture-mutation.json",
      "fixtures/platform-path-consolidation/mutations/new-root-executable.platform-architecture-mutation.json",
      "fixtures/platform-path-consolidation/mutations/new-test-executable.platform-architecture-mutation.json",
      "fixtures/platform-path-consolidation/mutations/new-workflow-executable.platform-architecture-mutation.json",
      "fixtures/platform-path-consolidation/mutations/package-alias-import.platform-architecture-mutation.json",
      "fixtures/platform-path-consolidation/mutations/package-lock-drift.platform-architecture-mutation.json",
      "fixtures/platform-path-consolidation/mutations/package-script-expansion.platform-architecture-mutation.json",
      "fixtures/platform-path-consolidation/mutations/phase-import.platform-architecture-mutation.json",
      "fixtures/platform-path-consolidation/mutations/policy-weakening.platform-architecture-mutation.json",
      "fixtures/platform-path-consolidation/mutations/registered-neutral-bypass.platform-architecture-mutation.json",
      "fixtures/platform-path-consolidation/mutations/registered-route-bypass.platform-architecture-mutation.json",
      "fixtures/platform-path-consolidation/mutations/shebang-executable.platform-architecture-mutation.json",
      "fixtures/platform-path-consolidation/mutations/source-identity-branch.platform-architecture-mutation.json",
      "fixtures/platform-path-consolidation/mutations/typescript-import.platform-architecture-mutation.json",
      "schemas/platform-architecture-diagnostics.v0.schema.json",
      "schemas/platform-architecture-mutation.v0.schema.json",
      "schemas/platform-architecture-policy.v0.schema.json",
      "scripts/check-platform-architecture.mjs",
      "src/catalog-authority.js",
      "src/catalog-release-boundary.js",
      "src/javascript-module-scanner.js",
      "src/platform-architecture.js",
      "src/proof-runtime.js",
      "test/catalog-release-boundary.test.js",
      "test/platform-architecture-policy.test.js"
    ]
  },
  "protectedModules": [
    "src/catalog-authority.js",
    "src/catalog-consumer-kernel.js",
    "src/catalog-release-boundary.js",
    "src/design-system-compiler-proof.js",
    "src/design-system-ingestion-kernel.js",
    "src/javascript-module-scanner.js",
    "src/platform-architecture.js",
    "src/proof-runtime.js"
  ],
  "allowedProtectedEdges": [
    {
      "from": "scripts/check-platform-architecture.mjs",
      "to": "src/platform-architecture.js"
    },
    {
      "from": "src/capability-index-proof.js",
      "to": "src/design-system-compiler-proof.js"
    },
    {
      "from": "src/catalog-authority.js",
      "to": "src/proof-runtime.js"
    },
    {
      "from": "src/catalog-consumer-kernel.js",
      "to": "src/catalog-authority.js"
    },
    {
      "from": "src/catalog-consumer-kernel.js",
      "to": "src/catalog-release-boundary.js"
    },
    {
      "from": "src/catalog-consumer-kernel.js",
      "to": "src/proof-runtime.js"
    },
    {
      "from": "src/catalog-release-boundary.js",
      "to": "src/proof-runtime.js"
    },
    {
      "from": "src/design-system-compiler-proof.js",
      "to": "src/catalog-consumer-kernel.js"
    },
    {
      "from": "src/design-system-compiler-proof.js",
      "to": "src/design-system-ingestion-kernel.js"
    },
    {
      "from": "src/design-system-compiler-proof.js",
      "to": "src/javascript-module-scanner.js"
    },
    {
      "from": "src/design-system-compiler-proof.js",
      "to": "src/proof-runtime.js"
    },
    {
      "from": "src/design-system-ingestion-kernel.js",
      "to": "src/catalog-authority.js"
    },
    {
      "from": "src/design-system-ingestion-kernel.js",
      "to": "src/proof-runtime.js"
    },
    {
      "from": "src/p0.js",
      "to": "src/design-system-compiler-proof.js"
    },
    {
      "from": "src/platform-architecture.js",
      "to": "src/javascript-module-scanner.js"
    }
  ],
  "protectedDependencyExceptions": [],